KEY,English,Deutsch,Français,Italiano,Spanish,Portuguese (Euro),Portuguese (Brazil),Russian,Japanese,Chinese (simplified),Chinese (traditional)
chptitleWelcomeBack,Chapter 1: The Robinson Protocol,Kapitel 1: Das Robinson Protokoll,Chapitre 1 : Le protocole Robinson,,,,Capítulo 1: O Protocolo Robinson,Раздел 1: Протокол Робинзон,第一章：ロビンソン議定書,章节一：鲁滨逊计划,
chpPreWelcomeBack,"[i]...Initializing restart sequence...Checking logs...Reason for crash: unknown...Position: unknown...Titan: contact lost...Loading failsafe data...Restarting Integrated Data Assistant...Success![/i]\n\nGreetings, Commander!\n\nThis is I.D.A reporting for","[i]...Neustart initialisiert...Logs werden geprüft...Absturzgrund: unbekannt...Postion: unbekannt...Titan: kein Kontakt...Sicherheitsspeicher wird geladen...Integrierter Daten Assistent wird geladen...Erfolgreich![/i]\n\n
Willkommen zurück, Commander!\n\n",[i]... Initialisation de la séquence de redémarrage... Vérification des journaux... Raison de l'accident : inconnu... Position : inconnu... Titan : contact perdu... Chargement des données de sécurité intégrée... Redémarrage de l'Assistant intégré de donné,,,,"[i]...Seqüência de reinicialização...Verificando logs...Motivo da queda: desconhecido...Posição: desconhecido...Titan: contato perdido...Carregando dados de segurança...Reiniciando o Assistente Integrado de Dados...Sucesso![/i]\n\nSaudações, Comandante!\n",[i]...Инициализация последовательности перезапуска...Проверка журналов...Причина сбоя: неизвестно...Позиция: неизвестно...Титан: контакт потерян...Загрузка отказоустойчивых данных...Перезапуск данных интегрированного помощника...Успешно![/i]\n\nПоздравляю,,[i]...重启队列初始化中...检查日志...崩溃原因：未知...位置：未知...泰坦：失联...读取故障数据...重启数据整合助理成功！......[/i]\n\n n你好，指挥官！\n\nI.D.A向您报到。\n我很高兴在事故中您能幸存下来！我的内部传感器表明您的护甲只有轻微损伤。\n\n尽管您的生命体征都在正常范围内，研究表明，此类事件后大部分人都会感到不知所措。\n\n为了协助您，我按照鲁滨逊计划创建了一个任务列表。而且，在我们降落时，逃生舱的传感器发现附近有一座无人居住的建筑。,
chpdescWelcomeBack,I scanned the internal systems of the suit.\nSome of the integrated utilities are non-functioning but the critical ones are operational . I shall endeavor to repair or reconstruct them as we go.\n\nTechnical advice for handling the Survival Suit Mark II:\,"Bitte prüfen Sie zunächst Ihre Ausrüstung (TAB).\nEinige der Geräte scheinen defekt, aber die die wir benötigen, sind noch intakt. Ich werde versuchen, die defekten Geräte nach und nach wieder herzustellen\n\nHinweis zur Steuerung des Überlebensanzugs Mar","J'ai scanné les systèmes internes de la combinaison.\nQuelques-uns des utilitaires intégrés sont non fonctionnels, mais les principaux sont opérationnels. Je vais tenter de les réparer ou de les reconstruire au fur et à mesure.\n\nConseils techniques pour",,,,"Estudei os sistemas internos do traje.\nAlguns dos utilitários integrados não funcionam, mas os críticos estão operacionais. Eu vou tentar repará-los ou reconstruí-los à medida que avançarmos.\n\nConselhos técnicos para lidar com o Traje de Sobrevivência ","Я просмотрел внутренние системы костюма.\nНекоторые из интегрированных утилит не функционируют, но критические работают. Я попытаюсь отремонтировать или восстановить их пока мы будем идти.\n\nТехнический совет для костюма выживания Mark II:\n\nБольшая 
вн",,我扫描了护甲的内部系统，一些集成功能已损坏，但是核心电路完好，下一步我将努力修复或者更新这些功能。\n\n这件高阶生存护甲的操作如下：\n\n内部护甲转运系统可以轻松的从您的背包到快捷栏添加或替换物品或工具，通过鼠标左键[c][ff4444]拖拽和拖动[-][/c]或[c][ff4444]按住Shift + 点击鼠标左键[-][/c]。这也适用于从货箱存取物品！\n\n护甲上的无线命令接口允许您访问任何设备，只要对着它并使用按键[c][ff4444]F[-][/c]。\n\n若要显示我们之间的通信交流，可,
tasktitleCheckInventory,Check Loadout,Ausrüstung prüfen,Vérifier le chargement,,,,Verificar Equipamentos,Проверить снаряжение,機器の確認,检查随身物品,
taskheadCheckInventory,Check Loadout,Ausrüstung prüfen,Vérifier le chargement,,,,Verificar Equipamentos,Проверить снаряжение,機器の確認,检查随身物品,
acttitleCheckEscapePod,Grab items from Pod (F),Kapselinventar leeren (F),Récupérer les éléments du Pod (F),,,,Retire os itens da Cápsula (F),Захватите предметы из Спасательной капсулы (F),脱出ポッドからアイテムを取り出すには”F”を押す,从逃生舱中拿取物品（F）,
actdescCheckEscapePod,\n[c][66ffff]I.D.A. -[000]-[-][/c]\nPoint at the Escape Capsuel and hit [c][ff4444]F[-][/c] . Move all items to your inventory by clicking the arrow button in the top right corner!,,"\n[c] [66ffff] I.D.A. -[000]-[-][/c]\nVisez le module de survie et tapez[c] [ff4444] F[-] [/c]. Déplacer tous les éléments de votre inventaire en cliquant sur le bouton ""flèche"" en haut à droite !\n",,,,\n[c][66ffff]I.D.A. -[000]-[-][/c]\nMire para Capsula de Fuga e aperte [c][ff4444]F[-][/c] . Mova todos itens da cápsula para seu inventário clicando na seta superior á esquerda!,\n[c][66ffff]I.D.A. -[000]-[-][/c]\nНаведитесь на капсулу и нажмите [c][ff4444]F[-][/c] . Чтобы переместить все предметы к себе - нажмите на стрелку в верхнем правом углу!,\n[c][66ffff]I.D.A.   -[000]-[-][/c]\n脱出ポッドに近付き [c][ff4444]F[-][/c] を押し、右上隅にある矢印ボタンを押して全てのアイテムをインベントリへ移動させてください。,\n[c][66ffff]I.D.A. -[000]-[-][/c]\n对准逃生舱按[c][ff4444]F[-][/c]。一次将所有物品移至你的背包只要按一下容器打开画面顶部右上角的箭头按钮！,
acttitleCheckInventory,Open Inventory (TAB),Inventar öffnen (TAB),Ouvrir l'inventaire (Tab),,,,Abrir Inventário (TAB),Откройте инвентарь (TAB),インベントリを開くには”TAB”を押す,打开背包（TAB）,
actdescCheckInventory,\n[c][66ffff]I.D.A. -[001]-[-][/c]\nI recommend adding some of the items to your toolbelt for quick access.\n\nOpen your inventory [c][ff4444](TAB)[-][/c] and drag&drop the items to the toolbelt on the bottom. You can also use SHIFT+left mouse button to m,,\n[c] [66ffff] I.D.A. -[001]-[-] [/c]\nJe recommande d'ajouter certains éléments à votre barre outils pour un accès rapide.\n\nOuvrez votre inventaire [c][ff4444] TAB[-] [/c] et faites glisser & déposer les éléments sur la barre outils en bas. Vous pouvez,,,,[c][66ffff]I.D.A. -[001]-[-][/c]\nEu recomendo adicionar alguns itens ao seu cinto de ferramentas para um acesso rápido.\nAbra seu inventário [c][ff4444](TAB)[-][/c] e mova alguns itens para o cinto. Você pode usar SHIFT+BotãoEsq para movê-los!,\n[c][66ffff]I.D.A. -[001]-[-][/c]\nЯ рекомендую добавить некоторые предметы на свою панель для быстрого доступа.\n\nОткройте свой инвентарь [c][ff4444](TAB)[-][/c] и перетащите предметы в набор инструментов внизу. Вы также можете использовать SHIFT + ЛКМ,\n[c][66ffff]I.D.A.   -[001]-[-][/c]\nアイテムを素早く使用する為にツールバーへ装備する\n\n[c][ff4444](TAB)[-][/c] でインベントリを開き、ツールバーへアイテムをドラッグ＆ドロップするかShift + マウス左ボタンを押してください。,\n[c][66ffff]I.D.A. -[001]-[-][/c]\n我强烈建议将一些物品放到您的快捷栏以方便使用。\n\n打开你的背包[c][ff4444]（TAB）[-][/c] 将上述物品拖拽和拖动到屏幕下方的快捷栏。你也可以用按住SHIFT+点击鼠标左键的方式移动之！,
tasktitleEquipItems,Equip toolbelt,Werkzeuggürtel ausrüsten,Equiper la barre outils,,,,Equipar o cinto de ferramentas,Оснастить панель инструментов,ツールバーへの装備,装备快捷栏,
taskheadEquipItems,Equip toolbelt,Werkzeuggürtel ausrüsten,Equiper la barre outils,,,,Equipar o cinto de ferramentas,Оснастить панель инструментов,ツールバーへの装備,装备快捷栏,
acttitleEquipPistol,Equip pistol,Pistole anlegen,S'équiper du pistolet,,,,Equipar pistola,Возьмите пистолет,ピストルを装備する,装备一把手枪,
actdescEquipPistol,Drag and drop or use SHIFT+left mouse button to move item to your toolbelt,,Faites glisser-déposez ou utilisez MAJ + bouton gauche de la souris pour déplacer l'élément vers votre barre outils,,,,Clique e arraste ou use SHIFT+BotãoEsq do mouse para mover um item até seu cinto de ferramentas,Перетащите или используйте SHIFT+ЛКМ для перемещения предмета на панель быстрого доступа,ドラッグアンドドロップかShift +左マウスボタンでアイテムをツールバーへ移動させる,鼠标左键拖拽和拖动或按住SHIFT+点击鼠标左键的方式将物品移至你的快捷栏,
acttitleEquipMedikit,Equip Medikit,Medikit einstecken,S'équiper du Medikit,,,,Equipar Kit Médico,Возьмите аптечку,メディキットを装備する,装备医疗瓶,
actdescEquipMedikit,Drag and drop or use SHIFT+left mouse button to move item to your toolbelt,,Faites glisser-déposez ou utilisez MAJ + bouton gauche de la souris pour déplacer l'élément vers votre barre outils,,,,Clique e arraste ou use SHIFT+BotãoEsq do mouse para mover um item até seu cinto de ferramentas,Перетащите или используйте SHIFT+ЛКМ для перемещения предмета на панель быстрого доступа,ドラッグアンドドロップかShift +左マウスボタンでアイテムをツールバーへ移動させる,鼠标左键拖拽和拖动或按住SHIFT+点击鼠标左键的方式将物品移至你的快捷栏,
acttitleEquipPills,Equip Antidote,Antidote einstecken,S'équiper de l'Antidote,,,,Equipar Antídoto,Возьмите антидот,解毒剤を装備する,装备解毒药片,
actdescEquipPills,Drag and drop or use SHIFT+left mouse button to move item to your toolbelt,,Faites glisser-déposez ou utilisez MAJ + bouton gauche de la souris pour déplacer l'élément vers votre barre outils,,,,Clique e arraste ou use SHIFT+BotãoEsq do mouse para mover um item até seu cinto de ferramentas,Перетащите или используйте SHIFT+ЛКМ для перемещения предмета на панель быстрого доступа,ドラッグアンドドロップかShift +左マウスボタンでアイテムをツールバーへ移動させる,鼠标左键拖拽和拖动或按住SHIFT+点击鼠标左键的方式将物品移至你的快捷栏,
acttitleEquipRation,Equip Emergency Ration,Notration einstecken,S'équiper de la ration d'urgence,,,,Equipar Ração de Emergência,Возьмите аварийный паек,非常食を装備する,装备应急口粮,
actdescEquipRation,Drag and drop or use SHIFT+left mouse button to move item to your toolbelt,,Faites glisser-déposez ou utilisez MAJ + bouton gauche de la souris pour déplacer l'élément vers votre barre outils,,,,Clique e arraste ou use SHIFT+BotãoEsq do mouse para mover um item até seu cinto de ferramentas,Перетащите или используйте SHIFT+ЛКМ для перемещения предмета на панель быстрого доступа,ドラッグアンドドロップかShift +左マウスボタンでアイテムをツールバーへ移動させる,鼠标左键拖拽和拖动或按住SHIFT+点击鼠标左键的方式将物品移至你的快捷栏,
acttitleEquipWater,Equip purified water,Wasserflasche einstecken,S'équiper de l'eau purifiée,,,,Equipar agua purificada,Возьмите очищенную воду,精製水を装備する,装备纯净水,
actdescEquipWater,Drag and drop or use SHIFT+left mouse button to move item to your toolbelt,,Faites glisser-déposez ou utilisez MAJ + bouton gauche de la souris pour déplacer l'élément vers votre barre outils,,,,Clique e mova ou use SHIFT+BotãoEsq do mouse para mover um item ate a sua cinto de ferramentas,Перетащите или используйте SHIFT+ЛКМ для перемещения предмета на панель быстрого доступа,ドラッグアンドドロップかShift +左マウスボタンでアイテムをツールバーへ移動させる,鼠标左键拖拽和拖动或按住SHIFT+点击鼠标左键的方式将物品移至你的快捷栏,
tasktitleHideout,Find the shelter,Unterschlupf einrichten,Trouver l'abri,,,,Encontre o abrigo,Найдите убежище,避難できるシェルターを見つける,寻找庇护所,
taskheadHideout,Find the shelter,Unterschlupf einrichten,Trouver l'abri,,,,Encontre o abrigo,Найдите убежище,避難できるシェルターを見つける,寻找庇护所,
acttitleFindH,Follow the marker,Unterschlupf finden,Suivez le marqueur (GPS),,,,Siga a marcação,Следуйте указателю,マーカー地点へ向かう,跟随标记移动,
actdescFindH,\n[c][66ffff]I.D.A. -[002]-[-][/c]\nNow we need to find the shelter. Follow the [c][FFFF00]yellow marker[-][/c] on your HUD\n\n- Use [c][ff4444]SHIFT[-][/c] to sprint.\n- Use [c][ff4444]J[-][/c] to activate Jetpack.\n- Use [c][ff4444]SPACE[-][/c] to jump/,Nähern Sie sich dem Unterschlupf der auf Ihrem HUD markiert wurde,"\n[c] [66ffff] I.D.A. -[002]-[-] [/c]\nMaintenant, nous devons trouver l'abri. Suivez le[c] [FFFF00] marqueur jaune [-] [/c][c] à l'aide de votre HUD - [ff4444] Maj [-] [/c] pour sprinter.\n\n- Utilisez[c] [ff4444] J [-] [/c] pour activer le Jetpack.\n- U",,,,\n[c][66ffff]I.D.A. -[002]-[-][/c]\nAgora precisamos encontrar o abrigo. Siga a [c][FFFF00]marcação amarela[-][/c] no seu visor\n\n- Use [c][ff4444]SHIFT[-][/c] para correr.\n- Use [c][ff4444]J[-][/c] para ativar seu Jetpack.\n- Use [c][ff4444]SPACE[-][/c,\n[c][66ffff]I.D.A. -[002]-[-][/c]\nТеперь нам нужно найти убежище. Следуйте [c][FFFF00]желтому маркеру[-][/c] на вашем HUD\n\n- Используйте [c][ff4444]SHIFT[-][/c] для бега.\n- Используйте [c][ff4444]J[-][/c] чтобы активировать Jetpack.\n- Используйте [c,\n[c][66ffff]I.D.A.   -[002]-[-][/c]\n次にシェルターを探す必要があります。 HUDに表示されている[c][FFFF00]黄色いマーカー[-][/c]へ向かってください。\n\n- [c][ff4444]SHIFT[-][/c] でダッシュします。\n- [c][ff4444]J[-][/c] でジェットパックを使用します。\n- [c][ff4444]SPACE[-][/c] でジャンプ（ジェットパック使用中には上昇）します。\n- [c][ff4444]L[-][/,\n[c][66ffff]I.D.A. -[002]-[-][/c]\n现在我们必须找个庇护所。跟随你显示器上的[c][FFFF00]黄色标记[-][/c]移动。\n\n- 按住 [c][ff4444]SHIFT[-][/c]奔跑。\n- 按 [c][ff4444]J[-][/c] 激活喷气背包。\n- 按或按住 [c][ff4444]空格[-][/c] 跳跃或大跳。\n- 按 [c][ff4444]L[-][/c] 打开你护甲的肩灯。\n- 按 [c][ff4444]U[-][/c] 摘下你的头盔以节省,
tasktitleHideout2,Activate shelter,Unterschlupf aktivieren,Activer l'abri,,,,Ativar o abrigo,Активировать убежище,シェルターを稼働させる,激活庇护所,
taskheadHideout2,Activate shelter,Unterschlupf aktivieren,Activer l'abri,,,,Ativar o abrigo,Активировать убежище,シェルターを稼働させる,激活庇护所,
acttitleFindTank,Find Fuel Tank,Tank finden,Trouver le réservoir de carburant,,,,Encontre o Tanque de Combustível,Найти топливный бак,燃料タンクを探す,找到燃料罐,
actdescFindTank,"\n[c][66ffff]I.D.A. -[003]-[-][/c]\nThere it is!\n\nOut of fuel - as expected. We need to reactivate the base first.\n- Find the Fuel Tank, aim at it and hit [c][ff4444]F[-][/c].",,"\n[c] [66ffff] I.D.A. -[003]-[-] [/c]\nLe voilà ! Plus de carburant bien sur ! et nous avons besoin de réactiver la base tout d'abord.\n Trouvez le réservoir de carburant, visez-le et appuyez sur[c] [ff4444] F [-] [/c].\n",,,,"\n[c][66ffff]I.D.A. -[003]-[-][/c]\nAqui estamos!\n\nSem combustível - como esperado. Nós precisamos reativar a base primeiro.\n- Encontre o Tanque de Combustível, mire nele e aperte [c][ff4444]F[-][/c].","\n[c][66ffff]I.D.A. -[003]-[-][/c]\nЭто здесь!\n\nТоплива нет - как и ожидалось. Нам нужно сначала реактивировать базу.\n- Найти топливный бак, прицелиться в него и нажать [c][ff4444]F[-][/c].",\n[c][66ffff]I.D.A.   -[003]-[-][/c]\n見つけた！しかし燃料が不足している、再稼働させるためには燃料を充填しなければいけない\n持っている燃料を入れてください。[c][ff4444]F[-][/c].,\n[c][66ffff]I.D.A. -[003]-[-][/c]\n就是它！\n\n没有能源了 - 嗯嗯，和我预计的一样！我们首先要激活它。\n- 找到燃料罐，对准它按[c][ff4444]F[-][/c]。,
acttitleFillTank,Fill Fuel Tank,Tank füllen,Remplir le réservoir de carburant,,,,Complete o Tanque de Combustível,Наполните топливный бак,燃料を入れる,填充燃料罐,
actdescFillTank,\n[c][66ffff]I.D.A. -[003]-[-][/c]\nDrag the fuel pack to the intake to fill the tank.,,"\n[c][66ffff] I.D.A. -[004]-[-] [/c]\nFaites glisser le pack carburant de votre inventaire vers le réservoir.\nC'est pas beaucoup de carburant, mais c'est mieux que rien.\n",,,,\n[c][66ffff]I.D.A. -[003]-[-][/c]\nArraste o pacote de combustível para a entrada para preencher o tanque.,\n[c][66ffff]I.D.A. -[003]-[-][/c]\nПеретащите топливо в бак до его заполнения.,\n[c][66ffff]I.D.A.   -[003]-[-][/c]\n燃料パックをドラッグして燃料タンクに投入してください。,\n[c][66ffff]I.D.A. -[003]-[-][/c]\n将你身上的燃料包拖进燃料罐填充。,
acttitleActivate,Activate Base (Y),Basis einschalten (Y),Activer la Base (Y),,,,Ative a Base (Y),Активируйте базу (Y),拠点を有効化するには”Y”を押す,激活基地（Y）,
actdescActivate,"\n[c][66ffff]I.D.A. -[004]-[-][/c]\nThats not a lot of fuel, but better than nothing.\n\nNow go inside or stand on a block that is part of the base, which will activate the wireless command interface\nUse the [c][ff4444]Y[-][/c] button on your keyboard to",,"\n[c] [66ffff] I.D.A. -[005]-[-] [/c]\nMaintenant, entrez ou positionnez-vous sur un bloc qui fait partie de la base, ce qui activera l'interface de commande sans fil, et utiliser la touche[c] [ff4444] Y [-] [/c] de votre clavier pour activer la base.\n\n",,,,"\n[c][66ffff]I.D.A. -[004]-[-][/c]\nIsso não é muito combustível, mas melhor que nada.\n\nAgora entre ou fique em um bloco que faz parte da base, o que ativará a interface de comando sem fio\nUse o botão [c][ff4444]Y[-][/c] do seu teclado para ativar a ba","\n[c][66ffff]I.D.A. -[004]-[-][/c]\nМало топлива, но лучше, чем ничего.\n\nЗайдите внутрь или встаньте на блок, который является частью базы, чтобы иметь возможность активировать беспроводной интерфейс\nИспользуйте кнопку [c][ff4444]Y[-][/c] на клавиатуре",\n[c][66ffff]I.D.A.   -[004]-[-][/c]\n燃料パックは少ししかないが、無いよりはましだろう\nすぐ中に入り、基地の内部からワイヤレスコマンドインターフェイスを起動します。キーボードの\n [c][ff4444]Y[-][/c] を押すことで基地の電源を入れることができる。,\n[c][66ffff]I.D.A. -[004]-[-][/c]\n嗯，你放进的燃料不是很多，但总比没有强不是？\n\n现在进入基地或者站到基地的一个方块上，这样可以激活无线命令界面\n按[c][ff4444]Y[-][/c] 键激活基地。\n\n小心一点那个启动的发电机。它会产生大量热量 - 久而久之会对你有害，这取决你护甲的隔热水平。,
tasktitleHideout2b,Find additional equipment,Finde Zusatzequipment,Trouver du matériel supplémentaire,,,,Encontre equipamento adicional,Найти дополнительное оборудование,追加の装備を見つける,搜寻额外装备,
taskheadHideout2b,Find additional equipment,Finde Zusatzequipment,Trouver du matériel supplémentaire,,,,Encontre equipamento adicional,Найти дополнительное оборудование,追加の装備を見つける,搜寻额外装备,
acttitleCheckEquipment1,Find equipment locker,Geräteschrank finden,Trouver les casiers équipement,,,,Encontre o armário de equipamento,Найти шкафчик оборудования,装備品ロッカーを見つける,找到装备柜子,
actdescCheckEquipment1,\n[c][66ffff]I.D.A. -[005]-[-][/c]\nWe are lucky!\nThe Base AI has told me there is additional stuff stored in a locker. Go find and open it!,,\n[c] [66ffff] I.D.A. -[006]-[-] [/c]\nNous sommes chanceux !\nL'IA de la Base m'a dit il y a des trucs supplémentaires stockées dans des casiers. Trouvez-les et ouvrez-les !\n,,,,\n[c][66ffff]I.D.A. -[005]-[-][/c]\nEstamos com sorte!\nA IA da Base me disse que tem equipamento adicional em um armário. Vamos encontrar e abrir pra ver!,"\n[c][66ffff]I.D.A. -[005]-[-][/c]\nНам повезло!\nИИ Базы сказал мне, что в шкафчике есть дополнительный материал. Найдите и откройте его!",\n[c][66ffff]I.D.A.   -[005]-[-][/c]\n幸いにも\nロッカーに装備類が保管されている事をAIが教えてくれた。探して手に入れよう！,\n[c][66ffff]I.D.A. -[005]-[-][/c]\n我们太幸运了！\n基地的人工智能告诉我在基地的柜子里存有一些额外的材料和装备。去找找看！,
acttitleCheckEquipment2,Open equipment locker,Geräteschrank öffnen,Vider les casiers équipement,,,,Abra o armário de equipamento,Откройте шкафчик для оборудования,装備品ロッカーを開く,打开装备柜子,
actdescCheckEquipment2,"\n[c][66ffff]I.D.A. -[005]-[-][/c]\nUse Drag&Drop, SHIFT+left mouse button or the [c][ff4444]arrow-icon[-][/c] on the top right to move all items to your suit inventory.",,"\n[c] [66ffff] I.D.A. -[007]-[-] [/c]\nUtilisez glisser-déposer, Maj + bouton gauche de la souris ou[c] [ff4444] Icône flèche [-] [/c]dans le coin supérieur droit (cette dernière option permet de déplacer tous les éléments d'un coup vers l'inventaire de v",,,,"\n[c][66ffff]I.D.A. -[005]-[-][/c]\nClique e mova, ou use SHIFT+botão esquerdo do mouse ou a [c][ff4444]seta[-][/c] no topo direito para mover tudo pro inventário do seu traje.","\n[c][66ffff]I.D.A. -[005]-[-][/c]\nИспользуйте перетаскивание, SHIFT + ЛКМ или значок [c][ff4444]стрелки[-][/c] в правом верхнем углу, чтобы переместить все предметы в инвентарь.",\n[c][66ffff]I.D.A.   -[005]-[-][/c]\nドラッグ＆ドロップ、Shift + マウス左ボタン、右上隅[c][ff4444]矢印アイコン[-][/c]いずれかの方法で全てのアイテムをインベントリへ移動させてください。,\n[c][66ffff]I.D.A. -[005]-[-][/c]\n利用鼠标左键拖拽和拖动、按住SHIFT+点击鼠标左键或点击右上角[c][ff4444]箭头按钮[-][/c]的方式将所有物品移至你的背包。,
tasktitleGetMobile,Improve mobility,Mobilität steigern,Améliorer la mobilité,,,,Melhorar mobilidade,Улучшение мобильности,移動性を向上させる,更快速的探索,
taskheadGetMobile,Improve mobility,Mobilität steigern,Améliorer la mobilité,,,,Melhorar mobilidade,Улучшение мобильности,移動性を向上させる,更快速的探索,
acttitleEquipSC,Equip Constructor,Construktor ausrüsten,S'équiper du constructeur,,,,Equipar Construtor,Экипируйте Конструктор,コンストラクタを装備する,装备求生建造机,
