KEY,English,Deutsch,Français,Italiano,Spanish,Portuguese (Euro),Portuguese (Brazil),Russian,Japanese,Chinese (simplified),Chinese (traditional)
actdescAmmo,[i]Q: How do I reload / add ammo to my guns and turrets?[/i]\n- You need to build an ammo box and add it to your base or vessel. Then find out which ammo your guns need and just put it in the ammo box. The ammo box does not need to be near the turret. Kee,,[i]Q: Comment puis-je recharger / ajouter des munitions à mes canons et tourelles ? [/i]\nVous avez besoin de fabriquer une caisse de munitions et de l'ajouter à votre Base ou vaisseau. Puis remplissez-la de munitions adaptées à vos armes. La caisse n'a p,,,,[i]P: Como recarregar/adicionar munição às minhas armas e armas fixas? [/i]\n- Você precisa construir uma caixa de munição e adicioná-la à sua base ou a sua nave. Então descubra qual munição suas armas precisam e apenas coloque-o na caixa de munição. A ca,[i]В: Как мне перезарядить подвесные орудия и турели или добавить им боеприпасов?[/i]\n- Вы должны сделать патронный короб и установить его на базу или судно. Определить нужный вид боеприпасов и положить нужное их количество в патронный короб. Патронный к,,[i]问：在基地或飞船里，如何给我的武器和炮塔装填弹药？[/i]\n- 你需要建造弹药箱放置在基地或飞船里。并制造对应你武器型号的弹药，放到弹药箱里。弹药箱不一定非得挨着武器放置，所以尽量将弹药箱放置在安全位置。\n- 当你按住鼠标左键不停的射击，弹药耗尽后，武器和炮塔会自动装填。\n- 你也可以通过驾驶台或者乘员座椅进入一个炮塔，手动射击或装填。当你坐在驾驶台或者乘员座椅上时，按P打开控制面板，选定炮塔，点右上的“访问”进入或直接双击进入。点“返回”键退出炮塔到控制面板界面，或者按F（默认）完全退出。\,
acttitleTaccess,Turret Access and Targeting (CV / HV),,Accès tourelle et ciblage,,,,Acessando às Armas Fixas e Mirando (CV / HV),Доступ к турелям и наведение (БС),エイリアンのPOIと艦船,武器和炮塔的进入和攻击目标设定,
actdescTaccess,"[i]Q: How do I access a turret for a Hover Vessel and Capital Vessel?[/i]\nEnter the cockpit or a passenger seat. Open the Control Panel (P) and find the turret in the list on the left. Then, either select the turret and use the ACCESS on the top right sc",,"[i]Q: Comment accéder à une tourelle depuis un Hover ou un vaisseau mère ? [/i]\nDepuis le cockpit ou un siège passager, ouvrez le panneau de contrôle (P) et recherchez la tourelle dans la liste sur la gauche. Ensuite, sélectionnez la tourelle et utilisez",,,,"[i]P: Como faço para acessar a arma fixa de um Hover Vessel ou Capital Vessel? [/i]\nEntre em uma cabine ou assento de passageiro. Abra o Painel de controle (P) e encontre a arma fixa na lista à esquerda. Então, selecione a arma fixa e use o ACESSAR na te","[i]В: Как я могу получить доступ к турели на парящем или большом судах?[/i]\nСядьте в кабину или на пассажирское сиденье. Откройте панель управления (P) и найдите нужную турель в списке слева. Затем, когда вы выбрали турель в списке, нажмите ДОСТУП справа",エイリアンのPOIと艦船,[i]问：我怎样进入悬浮飞船和母舰的炮塔？[/i]\n进入驾驶舱或乘员座椅，通过控制面板进入（详细见上面）。使用“F”键（默认）完全退出。\n\n[i]问：基地的炮塔如何进入？[/i]\n直接通过控制面板进入，或者靠近炮塔直接按“F”键（默认）进入。\n\n[i]问：各类炮塔如何选择目标？[/i]\n无人进入的炮塔是自动控制炮塔，会自动向任何进入射程的预设好的目标射击。要想改变预设目标，进入控制面板，选择炮塔，在右侧你可以点选炮塔的攻击目标，也可以将炮塔暂时禁用。\n- 其他派系（Other Factio,
tasktitlePOI,Alien POI and Vessels,,Vaisseaux et POI Alien,,,,POI e Vessels Alienígenas,ТИ чужих,POIのドアが反応しない,外星人信息点建筑和飞船,
taskheadPOI,Alien POI and Vessels,,Vaisseaux et POI Alien,,,,POI e Vessels Alienígenas,ТИ чужих,[i] Q：POIのドアを開けることができません！[/i] /nエイリアンコアを破壊しない限り、武器を使い強引に開ける必要があります。,外星人信息点建筑和飞船,
acttitlePdoor,POI Door Not Responding,,Entrer dans un POI,,,,Porta da POI não responde.,Двери ТИ не работают,POIブロックが破壊できない,打不开的外星门,
actdescPdoor,"[i]Q: I cannot open the door of the POI!?[/i]\nAs long as you did not destroy the Alien Core, you need to open the doors by force, what means by weapon fire.",,"[i]Q: je ne peux pas ouvrir la porte d'un POI ? [/i]\nTant que vous n'aurez pas détruit le noyau Alien, vous devrez ouvrir les portes par la force, à l'aide d'arme à feu.\n",,,,"[i]P: Não posso abrir a porta do POI!? [/i]\nEnquanto você não destruir o Núcleo Alien, você precisa abrir as portas á força, o que significa por arma de fogo.","[i]В: Почему я не могу открыть дверь в ТИ?[/i]\nДо тех пор, пока вы не уничтожите ядро чужих, вам придется преодолевать двери с помощью силы, то есть расстреливая их из оружия.",[i] Q：エイリアンコアを破壊したいのですが、エイリアンコアを破壊することができません！[/i] /nエイリアンコアを破壊するとすぐに、ベースはオープンされます。 PvE環境では、ベースのブロックが武器から保護されることを意味します。Remove and Repairツールを使用してください（自身のベースで作業しているように）,[i]问：我能自由开启外星人建筑的门么？[/i]\n除非你已摧毁该建筑的外星人核心，否则你只有使用武力硬闯了，也就是要用枪射击或是炸药包炸开。,
acttitlePblocks,POI Blocks Indestructible,,POI et blocs indestructibles,,,,Blocos de POI Indestrutíveis,Неразрушаемые блоки ТИ,POIディフェンダー補強,外星人建筑方块坚不可摧,
actdescPblocks,"[i]Q: I have destroyed the Alien Core and cannot destroy blocks of the base anymore!?[/i]\nAs soon as you destroyed the Alien Core, the base is set to public. What means, that in a PvE environment, the blocks of the base are protected against any weapon f",,"[i]Q: J'ai détruit le noyau Alien et ne peut toujours pas détruire les blocs de la base ? [/i]\nDès que le noyau Alien est détruit, la Base est définie ""Public"". Ce qui signifie que dans un environnement PvE, les blocs de la base sont protégés contre tout",,,,"[i]P: Eu destruí o Núcleo Alien e não posso mais destruir blocos da base?? [/i]\nAssim que você destruir o Núcleo Alien, a base é definida como pública. O que significa que em um ambiente PvE, os blocos da base estão protegidos contra qualquer arma de fog","[i]В: Я уничтожил ядро чужих, но теперь не могу разрушить ни одного блока базы - почему!?[/i]\nКак только вы уничтожили ядро чужих, база приобрела статус публичной. Это означает, что в режиме PvE блоки базы защищены от огня из любого оружия. Теперь для их",[i] Q：エイリアンソルジャーとディフェンダーが復活します。助けてください。[/i] /nテレポーターを破壊する必要があります！床にあるテレポーターブロックに気をつけて！す！あなたがPOIを離れると、5分後に彼らはテレポートし、再びPOIに戻ってきます。,[i]问：我已经摧毁了外星人建筑的核心，但是我怎么突然不能破坏该建筑的方块了？[/i]\n当你摧毁了一个建筑的核心时，该建筑将自动设定为公共状态。也就是说，如果该建筑是在PvE区域，那么该建筑的方块将会受到保护不允许任何人武力摧毁，那么只能使用多功能建造枪去拆卸建筑方块了，因为公共建筑可以视为你的个人建筑。,
acttitleTeleporter,POI Defenders Reinforcements,,Renforts POI,,,,Reforços dos Defensores das POIs,Подкрепления защитников ТИ,POIの取得,外星人建筑的防守援兵,
actdescTeleporter,[i]Q: Alien Soldiers and Defenders keep respawning. Help!?[/i]\nYou need to destroy their teleporters! Watch out for the teleporter blocks on the floor! The reinforcements will stop no earlier than you having destroyed their gateways! If you leave the POI,,"[i]Q: Les soldats Alien et défenseurs continuent à être générés. A l'aide !? [/i]\nVous devez détruire leur téléporteur ! Les renforts Alien continueront d'affluer tant que vous n'aurez pas détruit leurs téléporteur ! Si vous quitter le POI, au bout de 5 ",,,,[i]P: Soldados alienígenas e defensores continuam renascendo. Ajuda!? [/i]\nVocê precisa destruir seus teletransportadores! Cuidado com os blocos de teletransportadores no chão! Os reforços não pararão até que você tenha destruído seus portais! Se você de,"[i]В: Солдаты и защитники чужих постоянно возрождаются. Помогите!?[/i]\nВы должны уничтожить их телепорты! Ищите блоки телепортов на полу! Подкрепления будут поступать до тех пор, пока не будут уничтожены все порталы! Если вы покинете ТИ, через 5 минут он",[i] Q：POIをキャプチャして自分の基地にすることは可能ですか？[/i] /nもちろん、エイリアンイオンキャノン、テレポータ、セントリーガンは動作しなくなります。,[i]问：外星人士兵和防守援兵不断刷新，扛不住了，救命！[/i]\n在你摧毁核心之前，你必须摧毁他们的传送装置（刷新点）！仔细查看地面、墙面或顶棚，是否有外星人刷新点。当你摧毁了外星人刷新点敌人才不会继续刷新。如果你不摧毁，当你离开该建筑超过5分钟，外星人将全部信春哥。,
acttitlePbase,Capture POI,,Capture de POI,,,,Capturar POI,Захват ТИ,AI艦船,占领外星人建筑,
actdescPbase,"[i]Q: Is it possible to capture a POI and make it my own base?[/i]\nOf course, although Alien Ion Cannons, Teleporters and Sentries will not work anymore.",,"[i]Q: est-il possible de capturer un POI et d'en faire sa propre Base ? [/i]\nBien sûr, malgré que les canons à ion Alien, les téléporteurs et les tourelles sentinelles ne fonctionneront plus.\n",,,,"[i]P: É possível capturar um POI e torná-lo minha própria base? [/i]\nClaro, embora os Canhões de ION, Teleporters e Sentinelas não funcionem mais.","[i]В: Возможно ли захватить ТИ и сделать из нее собственную базу?[/i]\nКонечно, однако ионные пушки, телепорты и охранные турели чужих перестанут работать.",[i] Q：フリーギア、パトロール船とAIキャリアの違いは何ですか？[/i] /nA：貨物船（FR）/n-軌道でのみ見つけることができます。/n-プレイフィールドに入り、A地点からB - プレイフィールドを離れる/n-停止可能（スラスターを破壊する）、入力して略奪した/nA：パトロール船（PV）/n-ほとんどの惑星で見つけることができる/n-プレイヤーは、 n - 退却することができます（下のスラスタを破壊する）/n-短剣は複雑になることがあります（武装しており、破壊する前に破壊する可能性があります）/n,[i]问：有没有可能占领一座外星人建筑作为我自己的基地？[/i]\n当然，但是外星离子炮，传送装置和哨卫机枪都不会再继续工作。（这里曾经有极恶心的bug，在PVE区域里，有人替换了外星人基地的核心之后，炮塔继续工作，过路新手无不死去活来。因为该建筑属于其他玩家PVE区域不能摧毁，可炮塔却能始终攻击玩家，所以官方把炮塔改了不能继续工作。-译者注）,
acttitleAIvessels,AI Vessels,,Vaisseaux Alien,,,,Vessels controlados por IA,ИИ Судов,プレイヤードローン,外星人飞船,
actdescAIvessels,"[i]Q: What's the difference between Freighers, Patrol Vessels and AI Carriers?[/i]\nA: Freighters (FR)\n- Can only be found in orbits\n- Enter the playfield, travel from point A to point B and leave the playfield\n- Can be stopped (destroy back thrusters)",,"[i]Q: quelle est la différence entre les Cargos, les Patrouilleurs et les Transporteurs AI ? [/i]\n\nCargos (FR) :\nPeuvent être trouvés seulement en orbite. Ils entrent dans la zone de jeu, la traverse d'un point A à un point B, puis la quittent. Ils peu",,,,"[i]P: Qual a diferença entre Cargueiros, Vessels de Patrulha e Cargueiros controlados por AI? [/i]\nA: Cargueiros (FR)\n- Só pode ser encontrado em órbitas\n- Entre no playfield, viaje do ponto A ao ponto B e deixe o playfield\n- Pode ser parado (destruir","[i]В: Чем отличаются Freighers, Patrol Vessels and AI Carriers?[/i]\nA: Freighters (FR)\n- Может быть найден только на орбите\n- Он входит в игровое поле, летит из точки А в точку Б и покидает игровое поле\n- Может быть остановлено (уничтожьте задние двиг",プレイヤードローン,[i]问：各类货舰、巡查舰、太空航母有啥区别？[/i]\n答1: 货舰(FR)\n- 只能在星球轨道中找到\n- 航行路径只是简单的从A到B，进入一片星空然后离开\n- 可以被强制停船（摧毁向后推进器），进入和搜刮\n答2:巡查舰(PV)\n- 各个星球上都有\n- 只要发现玩家就会跟踪并攻击玩家\n- 都会有一个修理平台建筑以供被打败后修理\n- 能被击落（摧毁向下推进器）\n- 搜刮困难（此类飞船护甲结实，如果核心被打爆将很快自毁，搜刮时间有限）\n- 它们目前不会攻击玩家基地，目标只是玩家和其飞船\,
tasktitlePdrone,Player Drone,,Drone-joueur,,,,Drone do Jogador,Дрон игрока,建物ヘルパー,玩家无人机,
taskheadPdrone,Player Drone,,Drone-joueur,,,,Drone do Jogador,Дрон игрока,[i] Q：プレーヤードローンはどのように機能しますか（F5）？[/i] /nドローンは建物のヘルパーです。それは、青写真の配置と削除と修復ツールの使用を含むすべての建物の機能を使用することができます。まだすべてのツールや武器を使用することはできません。 /n /nプレーヤー無人機を起動するにはF5を押してください。それはあなたにリソースやエネルギーをかけることはありませんが、その範囲は限られています。あなたが遠ざかっていくと、視界が歪んで最終的に切り取られます。あなたの無人機は失われています。あなたはF,玩家无人机,
acttitlePlayerD,Building Helper,,Aide à la construction,,,,Ajudante de Construção,Помощник в строительстве,ファクション,建筑好帮手,
actdescPlayerD,[i]Q: How does the Player Drone work (F5)?[/i]\nThe drone is a building helper. It can use all building features including placing blueprints and using the Remove & Repair tool. It cannot use ALL tools or weapons yet. \n\nHit F5 to spawn the Player drone.,,[i]Q: comment le Drone-joueur fonctionne ? [/i]\nLe drone est un aide à la construction. Il peut utiliser toutes les fonctionnalités de la construction y compris l'utilisation de l'Outil Multifonctions et également plaçer les blueprints. Il ne peut pas en,,,,"[i]P: Como o Player Drone funciona (F5)? [/i]\nO drone é um ajudante de construção. Ele pode usar todos os recursos de construção, incluindo a colocação de blueprints e usando a ferramenta Remover e Reparar. Ainda não pode usar TODAS as ferramentas ou arm","[i]В: Как работает дрон игрока (F5)?[/i]\nДрон является помощников в строительстве. Он может использовать любые строительные функции, включая постройку по чертежам и мульти-инструмент. Пока что он не может использовать прочие инструменты и турели. \n\nНаж",ファクション,[i]问：玩家无人机(F5)如何设定？[/i]\n玩家无人机专职帮助玩家搞建筑，它能代替你的所有工作，甚至使用工具枪，但是，还不能使用所有的工具和武器。\n\n点击 F5 启动玩家无人机，这不会有任何消耗，但是它有控制范围的限制。如果玩家离他的无人机过远，开始会信号不好，再远点无人机会关闭。你只能再按F5启动。\n\n无人机关闭或者被其他玩家摧毁，你不用担心无人机快捷栏里的东西会丢失，实际上，那是你的快捷栏而已。,
tasktitleFaction,Faction,,Faction,,,,Facção,Фракция,作成＆参加,派系,
taskheadFaction,Faction,,Faction,,,,Facção,Фракция,[i] Q：派閥の作成または参加方法[/ i]/n-インベントリを開き、ファクション・ボタンをクリックします。 ふさわしいファクションを作成してください。/n-既存のファクションに参加することもできますし、自身のファクションを同じ画面から管理することもできます,派系,
acttitleJoin,Create or Join,,Créer ou rejoindre une Faction,,,,Criar ou Juntar-se,Создание и присоединение,ファクションにおいての所有権の変更,创建和加入,
actdescJoin,[i]Q: How to create or join a faction?[/i]\n- Open your inventory and click the Faction button. Just create one as you see fit. \n- You can join an existing faction or manage your faction (candidates) from the same screen,,"[i]Q: comment créer ou rejoindre une Faction ? [/i]\nVous pouvez accéder à l'écran des Factions avec la touche ""F4"" ou via l'inventaire puis l'icone ""Factions"" en haut dans la barre d'icônes. Il suffit alors de créer ou de rejoindre (demander une alliance",,,,[i]P: Como criar ou entrar em uma facção? [/i]\n- Abra seu inventário e clique no botão Facção. Apenas crie um como achar adequado.\n- Você pode participar de uma facção existente ou gerenciar sua facção (candidatos) da mesma tela,"[i]В: Как создать фракцию или вступить в существующую?[/i]\n- Откройте ваш инвентарь и нажмите кнопку 'Фракция'. Дальше делайте так, как вам нравится. \n- Вы можете присоединиться к существующей фракции или создать собственную, а также можете управлять св",[i] Q：船舶や拠点のファクション・ステータスをパブリックからプライベートに戻すことは可能ですか？[/i]/nその設定は、ファクションの管理者だけが行うことができます。,[i]问：怎样创建和加入一个派系？[/i]\n- 打开你的背包界面，点击“派系”按钮，然后你就明白了。\n- 管理派系也是同样界面，前提你是创建者或者管理员。,
acttitleFvessel,Change Faction Property Ownership,,Changement statut de Faction,,,,Mude a Posse de uma Propriedade da Facção,Изменение принадлежности фракции,ファクションにおいてのオフライン・プロテクト,改变派系财产的所有权,
actdescFvessel,"[i]Q: Is it possible to revert the faction status of a vessel or base back to public or private?[/i]\nYes, but only the Faction owner can do that.",,"[i]Q: est-il possible de modifier le statut de la Faction d'une Base ou vaisseau en ""Public"" ou ""Privé"" ? [/i]\nOui, mais seul le propriétaire de la Faction peut le faire.\n",,,,"[i]P: É possível reverter o status de facção de um nave ou base de volta para público ou privado? [/i]\nSim, mas apenas o proprietário da facção pode fazer isso.","[i]В: Можно ли вернуть судну или базе личный или публичный статус?[/i]\nДа, но сделать это может лишь владелец (глава) фракции.",[i] Q：オフライン・プロテクションはPvP上の全てのファクション所有を保護しますか？[/i]/nもちろんですが、ファクション・メンバーが全員サーバーにいなくなった場合のみオフライン・プロテクションが有効になります。,[i]问：可以把本属于一个派系的飞船和基地转移所有权么？[/i]\n当然，但是只有派系创建者才能那样做。,
acttitleFoprot,Offline Protection for Faction Property,,Protection hors ligne de propriétés de Faction,,,,Proteção Offline para Propriedades da Facção,Офлайновая защита фракционных конструкций,デバイスごとのパブリック設定,派系财产的离线保护,
actdescFoprot,"[i]Q: Does the Offline Protection also protect all our faction structures in PvP?[/i]\nOf course, but for factions the Offline Protection only activates, if no one of your faction members is on the server anymore!",,"[i]Q: est-ce la Protection hors ligne protège aussi toutes les structures d'une Faction ? [/i]\nBien sûr, mais pour les factions la Protection hors ligne est active uniquement si aucun membre de la Faction n'est encore présenr sur le serveur !\n",,,,"[i]P: A Proteção Offline também protege todas as nossas estruturas de facções no PvP? [/i]\nClaro, mas para as facções, a Proteção Offline só se ativa, se nenhum dos membros da facção estiver no servidor!","[i]В: Распространяется ли офлайновая защита также и на все строения, принадлежащие фракции?[/i]\nКонечно да, но в случае с фракциями она начинает работать только тогда, когда от сервера отключаются все члены фракции!",[i] Q：特定の装置だけにパブリックを設定することはできますか？[/i]/nはい！ コントロールパネルからデバイスにアクセスし、ロックコードを設定するだけです。 パブリックアクセスの場合0000,[i]问：在PvP区域离线保护器是否会保护一个派系的所有建筑？[/i]\n当然，但只有所有派系成员都不在线时才能激活。,
acttitleFsetting,Set Single Device to Public,,Périphériques accessible au public,,,,Tornar um Dispositivo como Publico,Установка публичным единственного устройства,アライアンス,派系建筑内的公共设施,
actdescFsetting,[i]Q: Can I set specific devices like passenger seats for public use?[/i]\nYes! Just access the device via Control Panel and set a lock code. For public access use 0000,,[i]Q: puis-je définir des périphériques spécifiques comme un siège passager à usage public ? [/i]\nOui ! Juste accéder au périphérique via le panneau de configuration et définir un code de verrouillage. Pour un accès public utilisez 0000\n,,,,[i]P: Posso configurar dispositivos específicos como assentos de passageiros para uso público? [/i]\nSim! Basta acessar o dispositivo através do Painel de controle e definir um código de bloqueio. Para acesso público use 0000,"[i]В: Могу ли я указать публичный статус для отдельных устройств, например, пассажирского кресла?[/i]\nДа! В панели управления устройством можно задать код доступа. Для публичного использования укажите 0000.",[i] Q：ファクションを「友好的な同盟」としてマークし、私たちのデバイスを共有させる方法はありますか？[/i] /nはい！ 同盟を組みたいファクションに同盟要請を送ることができます！,[i]问：在派系的飞船或基地里我可以设置某个特殊的设备例如乘员座椅什么的公共使用么？ [/i]\n可以！只要进入控制面板界面，点击该设备，设置锁定密码即可，需要公共使用的密码设置“0000”,
acttitleFally,Allies,,Alliés,,,,Aliados,Союзники,コントロールパネル,同盟,
